<?xml version="1.0" encoding="utf-8"?>
<xs:schema xmlns:xs="http://www.w3.org/2001/XMLSchema">
  <xs:element name="Datatable" />
  <xs:element name="PlanetImprovementMappingDefinition" nillable="true" type="PlanetImprovementMappingDefinition" />
  <xs:complexType name="PlanetImprovementMappingDefinition">
    <xs:complexContent mixed="false">
      <xs:extension base="DatatableElement">
        <xs:attribute name="ImprovementName" type="xs:string" />
      </xs:extension>
    </xs:complexContent>
  </xs:complexType>
  <xs:complexType name="DatatableElement">
    <xs:attribute name="Name" type="xs:string" />
  </xs:complexType>
</xs:schema>